{
  "schema": "agent-dock/provider-fixture@1",
  "schemaSet": "agent-dock-provider-fixture-v1",
  "fixtureSet": "fake-interactive-v1",
  "id": "fake-interactive-approval-deny",
  "protocol": "v2",
  "provider": { "id": "claude", "implementation": "fake", "version": "fake-interactive-v1" },
  "transport": { "id": "fake-interactive", "version": "1" },
  "scenario": "approval-deny",
  "covers": ["approval-deny", "command-correlation"],
  "startup": { "started": "resolve", "acceptedWork": "accepted" },
  "nativeInput": [{ "prompt": "<redacted:prompt>" }],
  "nativeOutput": [
    {
      "phase": "startup",
      "channel": "events",
      "value": {
        "type": "session.started",
        "provider": "claude",
        "transport": "fake-interactive",
        "selection": "<fixture-selection>"
      }
    },
    {
      "phase": "startup",
      "channel": "events",
      "value": { "type": "turn.started", "turnId": "<turn-id>" }
    },
    {
      "phase": "startup",
      "channel": "events",
      "value": {
        "type": "approval.requested",
        "turnId": "<turn-id>",
        "requestId": "<request-id>",
        "title": "Fixture approval",
        "action": "<redacted:tool-action>",
        "target": "<redacted:tool-target>",
        "possibleEffects": [],
        "effectsComplete": true,
        "deadlineAt": "<deadline>"
      }
    },
    {
      "phase": "control:0",
      "channel": "events",
      "value": { "type": "turn.completed", "turnId": "<turn-id>" }
    },
    { "phase": "control:0", "channel": "events", "value": { "type": "session.completed" } }
  ],
  "controls": [
    {
      "operation": "send",
      "afterEvent": "approval.requested",
      "command": {
        "type": "approval.respond",
        "commandId": "<command-id>",
        "sessionId": "<session-id>",
        "turnId": "<turn-id>",
        "requestId": "<request-id>",
        "decision": "deny"
      }
    }
  ],
  "expectedNormalizedEvents": [
    {
      "type": "session.started",
      "provider": "claude",
      "transport": "fake-interactive",
      "selection": "<fixture-selection>"
    },
    { "type": "turn.started", "turnId": "<turn-id>" },
    {
      "type": "approval.requested",
      "turnId": "<turn-id>",
      "requestId": "<request-id>",
      "title": "Fixture approval",
      "action": "<redacted:tool-action>",
      "target": "<redacted:tool-target>",
      "possibleEffects": [],
      "effectsComplete": true,
      "deadlineAt": "<deadline>"
    },
    {
      "type": "approval.resolved",
      "turnId": "<turn-id>",
      "requestId": "<request-id>",
      "decision": "denied",
      "actor": "user"
    },
    { "type": "turn.completed", "turnId": "<turn-id>" },
    { "type": "session.completed" }
  ],
  "terminalState": {
    "type": "session.completed",
    "count": 1,
    "acceptedWork": "accepted",
    "workMayHaveStarted": true,
    "fallbackAllowed": false
  },
  "cleanup": { "closeCalls": 1, "forceCloseCalls": 0, "interactionResolutions": 0, "reaped": true }
}
