{
  "schema": "agent-dock/provider-fixture@1",
  "schemaSet": "agent-dock-provider-fixture-v1",
  "fixtureSet": "fake-interactive-v1",
  "id": "fake-interactive-interrupt",
  "protocol": "v2",
  "provider": { "id": "claude", "implementation": "fake", "version": "fake-interactive-v1" },
  "transport": { "id": "fake-interactive", "version": "1" },
  "scenario": "interrupt",
  "covers": ["interrupt"],
  "startup": { "started": "resolve", "acceptedWork": "accepted" },
  "nativeInput": [{ "prompt": "<redacted:prompt>" }],
  "nativeOutput": [
    {
      "phase": "startup",
      "channel": "events",
      "value": {
        "type": "session.started",
        "provider": "claude",
        "transport": "fake-interactive",
        "selection": "<fixture-selection>"
      }
    },
    {
      "phase": "startup",
      "channel": "events",
      "value": { "type": "turn.started", "turnId": "<turn-id>" }
    },
    {
      "phase": "control:0",
      "channel": "events",
      "value": { "type": "turn.interrupted", "turnId": "<turn-id>", "reason": "fixture interrupt" }
    },
    {
      "phase": "control:0",
      "channel": "events",
      "value": { "type": "session.status", "status": "idle" }
    },
    {
      "phase": "control:0",
      "channel": "events",
      "value": { "type": "session.interrupted", "reason": "fixture interrupt" }
    }
  ],
  "controls": [{ "operation": "interrupt", "afterEvent": "turn.started" }],
  "expectedNormalizedEvents": [
    {
      "type": "session.started",
      "provider": "claude",
      "transport": "fake-interactive",
      "selection": "<fixture-selection>"
    },
    { "type": "turn.started", "turnId": "<turn-id>" },
    { "type": "turn.interrupted", "turnId": "<turn-id>", "reason": "fixture interrupt" },
    { "type": "session.status", "status": "idle" },
    { "type": "session.interrupted", "reason": "fixture interrupt" }
  ],
  "terminalState": {
    "type": "session.interrupted",
    "count": 1,
    "acceptedWork": "accepted",
    "workMayHaveStarted": true,
    "fallbackAllowed": false
  },
  "cleanup": { "closeCalls": 1, "forceCloseCalls": 0, "interactionResolutions": 0, "reaped": true }
}
